<?xml version="1.0" encoding="UTF-8"?>
<brpackage xmlns:xsi="http://www.w3.org/2001/XMLSchema-instance" name="MobileEnrollment.xml" version="1.0" xsi:noNamespaceSchemaLocation="businessrules.xsd">
    <rule name="EnrollAccount" type="static" precedence="99">
        <condition>
            <item>
                <attribute>EventType</attribute>
                    <comparator name="equal" />
                <value>Application - PackagePostCommit</value>
            </item>
        </condition>
        <action Order="yes">
            <inprocess-agent id="1" executeafter="" streamaccess="none" wait="yes" class="com.axway.st.server.tm.packagemanager.agent.MobilePreEnrollmentAgent"/>
            <inprocess-agent id="2" executeafter="1" streamaccess="none" wait="yes" class="com.tumbleweed.st.server.tm.agents.NextPrecedence" />
            <inprocess-agent id="3" executeafter="2" streamaccess="none" wait="yes" class="com.axway.st.server.tm.packagemanager.agent.MobilePostEnrollmentAgent"/>
        </action>
    </rule>
</brpackage>

