<?xml version="1.0" encoding="UTF-8"?>
<brpackage xmlns:xsi="http://www.w3.org/2001/XMLSchema-instance" version="1.0" xsi:noNamespaceSchemaLocation="businessrules.xsd" name="SendToSite.xml">
    <rule name="SendToSite" type="static" precedence="99">
        <condition>
            <item>
                <attribute>EventType</attribute>
                <comparator name="equal" />
                <value>Incoming end</value>
            </item>
        </condition>
        <action Order="yes">
            <inprocess-agent id="1" executeafter="" streamaccess="none" wait="yes" class="com.tumbleweed.st.server.tm.agents.NextPrecedence"/>
            <inprocess-agent id="2" executeafter="1" streamaccess="all" wait="yes" class="com.tumbleweed.st.server.tm.agents.SendToSiteAgent" >
                <params>
                    <param>
                        <param-name>Impersonation</param-name>
                        <param-value>"true"</param-value>
                    </param>
                    <param>
                        <param-name>Site</param-name>
                        <param-value></param-value>
                    </param>
                </params>
            </inprocess-agent>
        </action>
    </rule>
</brpackage>

