<?xml version="1.0" encoding="UTF-8"?>
<brpackage xmlns:xsi="http://www.w3.org/2001/XMLSchema-instance"
    version="1.0" xsi:noNamespaceSchemaLocation="businessrules.xsd" name="InPermissionsCheck.xml">

    <!-- In-Process Permissions Check Rules -->
    <rule name="InPermissionsCheck" type="static" precedence="22">
        <condition>
            <expression>
                <item>
                    <attribute>EventType</attribute>
                    <comparator name="equal" />
                    <value>Incoming start</value>
                </item>
                <operator name="or" />
                <item>
                    <attribute>EventType</attribute>
                    <comparator name="equal" />
                    <value>Outgoing start</value>
                </item>
                <operator name="or" />
                <item>
                    <attribute>EventType</attribute>
                    <comparator name="equal" />
                    <value>FTP Cmd - LIST</value>
                </item>
                <operator name="or" />
                <item>
                    <attribute>EventType</attribute>
                    <comparator name="equal" />
                    <value>FTP Cmd - NLST</value>
                </item>
                <operator name="or" />
                <item>
                    <attribute>EventType</attribute>
                    <comparator name="equal" />
                    <value>FTP Cmd - DELE</value>
                </item>
                <operator name="or" />
                <item>
                    <attribute>EventType</attribute>
                    <comparator name="equal" />
                    <value>FTP Cmd - SIZE</value>
                </item>
                <operator name="or" />
                <item>
                    <attribute>EventType</attribute>
                    <comparator name="equal" />
                    <value>FTP Cmd - RTCK</value>
                </item>
                <operator name="or" />
                <item>
                    <attribute>EventType</attribute>
                    <comparator name="equal" />
                    <value>FTP Cmd - MDTM</value>
                </item>
                <operator name="or" />
                <item>
                    <attribute>EventType</attribute>
                    <comparator name="equal" />
                    <value>FTP Cmd - CWD</value>
                </item>
                <operator name="or" />
                <item>
                    <attribute>EventType</attribute>
                    <comparator name="equal" />
                    <value>FTP Cmd - MKD</value>
                </item>
                <operator name="or" />
                <item>
                    <attribute>EventType</attribute>
                    <comparator name="equal" />
                    <value>FTP Cmd - RMD</value>
                </item>
                <operator name="or" />
                <item>
                    <attribute>EventType</attribute>
                    <comparator name="equal" />
                    <value>FTP Cmd - RNFR</value>
                </item>
                <operator name="or" />
                <item>
                    <attribute>EventType</attribute>
                    <comparator name="equal" />
                    <value>FTP Cmd - RNTO</value>
                </item>
                <operator name="or" />
                <item>
                    <attribute>EventType</attribute>
                    <comparator name="equal" />
                    <value>FileMetadata - read</value>
                </item>
                <operator name="or" />
                <item>
                    <attribute>EventType</attribute>
                    <comparator name="equal" />
                    <value>FileMetadata - update</value>
                </item>                   
            </expression>
        </condition>
        <action Order="yes">
            <inprocess-agent id="1" executeafter="" streamaccess="none" wait="yes"
                class="com.tumbleweed.st.server.tm.agents.PermissionsCheckAgent" >
                <params>
                    <param>
                        <param-name>Impersonation</param-name>
                        <param-value>"true"</param-value>
                    </param>
                </params>
            </inprocess-agent>
            <inprocess-agent id="2" executeafter="1" streamaccess="none" wait="yes"
                class="com.tumbleweed.st.server.tm.agents.NextPrecedence"/>
        </action>
    </rule>

</brpackage>
