<?xml version="1.0" encoding="UTF-8"?>
<!-- @(#) $Id: LogEntryMaintApp.xml,v 1.1.2.3 2009-01-30 15:43:25 bzhivkov Exp $ -->
<!-- Do not delete the SecureTransport VERSION line below. -->
<!-- ~VERSION~ 1 -->
<brpackage xmlns:xsi="http://www.w3.org/2001/XMLSchema-instance" name="LogEntryMaintApp.xml" version="1.0" xsi:noNamespaceSchemaLocation="businessrules.xsd">
	<rule name="LogEntry Maintenance Application" type="static" precedence="100">
        <condition>
            <expression>
                <item>
                    <attribute>EventType</attribute>
                    <comparator name="equal" />
                    <value>Application - Schedule</value>
                </item>
                <operator name="and" />
                <item>
                    <attribute>DXAGENT_APPLICATION_TYPE</attribute>
                    <comparator name="equal" />
                    <value>LogEntryMaint</value>
                </item>
            </expression>
        </condition>
        <action Order="yes">
            <inprocess-agent id="1" executeafter="" streamaccess="none" wait="yes" class="com.tumbleweed.st.server.logentrymaintapp.agents.LogEntryMaintAgent" >
                <params>
                    <param>
                        <param-name>Impersonation</param-name>
                        <param-value>"true"</param-value>
                    </param>
                    <param>
                        <param-name>deleteChunk</param-name>
                        <param-value>0</param-value>
                    </param>
                    <param>
                        <param-name>sleepBetweenChunkMillis</param-name>
                        <param-value>0</param-value>
                    </param>
                </params>
            </inprocess-agent>
        </action>
    </rule>
</brpackage>

