<?xml version="1.0" encoding="UTF-8"?>
<!-- @(#) $Id: SiteMailbox.xml,v 1.11 2006-08-05 00:46:22 flam Exp $ -->
<!-- Do not delete the SecureTransport VERSION line below. -->
<!-- ~VERSION~ 1 -->
<brpackage xmlns:xsi="http://www.w3.org/2001/XMLSchema-instance" name="SiteMailbox.xml" version="1.0" xsi:noNamespaceSchemaLocation="businessrules.xsd">
	<rule name="SiteMailboxApplication" type="static" precedence="100">
        <condition>
            <expression>
                <item>
                    <attribute>EventType</attribute>
                    <comparator name="equal" />
                    <value>Application - Incoming</value>
                </item>
                <operator name="and" />
                <item>
                    <attribute>DXAGENT_APPLICATION_TYPE</attribute>
                    <comparator name="equal" />
                    <value>SiteMailbox</value>
                </item>
            </expression>
        </condition>
        <action Order="yes">
            <inprocess-agent id="1" executeafter="" streamaccess="none" wait="yes" class="com.tumbleweed.st.server.mailboxapp.agents.MailboxAppAgent" >
                <params>
                    <param>
                        <param-name>Impersonation</param-name>
                        <param-value>"true"</param-value>
                    </param>
                </params>
            </inprocess-agent>
            <inprocess-agent id="2" executeafter="1" streamaccess="none" wait="yes" class="com.tumbleweed.st.server.tm.agents.NextPrecedence" />
        </action>
    </rule>
	
	<rule name="SiteMailboxSubscription" type="static" precedence="100">
        <condition>
            <expression>
                <item>
                    <attribute>EventType</attribute>
                    <comparator name="equal" />
                    <value>Application - Init</value>
                </item>
                <operator name="and" />
                <item>
                    <attribute>DXAGENT_APPLICATION_TYPE</attribute>
                    <comparator name="equal" />
                    <value>SiteMailbox</value>
                </item>
            </expression>
        </condition>
        <action Order="yes">
            <inprocess-agent id="1" executeafter="" streamaccess="none" wait="yes" class="com.tumbleweed.st.server.mailboxapp.agents.MailboxSubscriptionAgent" >
                <params>
                    <param>
                        <param-name>Impersonation</param-name>
                        <param-value>"true"</param-value>
                    </param>
                </params>
            </inprocess-agent>
         </action>
    </rule>
	
</brpackage>

