<?xml version="1.0" encoding="UTF-8"?>
<!-- @(#) $Id: ArchiveMaintApp.xml,v 1.1.2.1 2008-09-01 15:56:43 kmilchev Exp $ -->
<!-- Do not delete the SecureTransport VERSION line below. -->
<!-- ~VERSION~ 1 -->
<brpackage xmlns:xsi="http://www.w3.org/2001/XMLSchema-instance" name="ArchiveMaintApp.xml" version="1.0" xsi:noNamespaceSchemaLocation="businessrules.xsd">
    <rule name="Archive Maintenance Application" type="static" precedence="100">
        <condition>
            <expression>
                <item>
                    <attribute>EventType</attribute>
                    <comparator name="equal" />
                    <value>Application - Schedule</value>
                </item>
                <operator name="and" />
                <item>
                    <attribute>DXAGENT_APPLICATION_TYPE</attribute>
                    <comparator name="equal" />
                    <value>ArchiveMaint</value>
                </item>
            </expression>
        </condition>
        <action Order="yes">
            <inprocess-agent id="1" executeafter="" streamaccess="none" wait="yes" class="com.tumbleweed.st.server.archivemaintapp.agents.ArchiveMaintAgent" >
                <params>
                    <param>
                        <param-name>Impersonation</param-name>
                        <param-value>"true"</param-value>
                    </param>
                </params>
            </inprocess-agent>
        </action>
    </rule>
</brpackage>

