<?xml version="1.0" encoding="UTF-8"?>
<brpackage xmlns:xsi="http://www.w3.org/2001/XMLSchema-instance" name="ArchiveAgent.xml" version="1.0" xsi:noNamespaceSchemaLocation="businessrules.xsd">
    <rule name="ArchiveMaint" type="static" precedence="29">
        <condition>
            <expression>
                <item>
                    <attribute>EventType</attribute>
                    <comparator name="equal" />
                    <value>Incoming end</value>
                </item>
                <operator name="or" />
                <item>
                    <attribute>EventType</attribute>
                    <comparator name="equal" />
                    <value>Server Transfer - Push</value>
                </item>
            </expression>
        </condition>
        <action Order="yes">
            <inprocess-agent id="1" executeafter="" streamaccess="none" class="com.tumbleweed.st.server.archivemaintapp.agents.ArchiveAgent">
                <params>
                    <param>
                        <param-name>Impersonation</param-name>
                        <param-value>"true"</param-value>
                    </param>
                </params>
            </inprocess-agent>
            <inprocess-agent id="2" executeafter="" streamaccess="none" class="com.tumbleweed.st.server.tm.agents.NextPrecedence" />
        </action>
    </rule>
</brpackage>

