<?xml version="1.0" encoding="UTF-8"?>
<!-- @(#) $Id: MDNReceipting.xml,v 1.12.4.1 2009-05-27 10:41:54 adzhigar Exp $ -->
<!-- Do not delete the SecureTransport VERSION line below. -->
<!-- ~VERSION~ 1 -->
<brpackage xmlns:xsi="http://www.w3.org/2001/XMLSchema-instance" name="MDNReceipting.xml" version="1.0" xsi:noNamespaceSchemaLocation="businessrules.xsd">


<rule name="MDNPreReceipts" type="static" precedence="7">
        <condition>
            <expression>
                <expression>
                    <item>
                        <attribute>EventType</attribute>
                        <comparator name="equal" />
                        <value>Incoming end</value>
                    </item>
                    <operator name="or" />
                    <item>
                        <attribute>EventType</attribute>
                        <comparator name="equal" />
                        <value>Outgoing end</value>
                    </item>
                </expression>
                <operator name="and" />
                <item>
                    <attribute>DXAGENT_CLIENT</attribute>
                    <comparator name="not-equal" />
                    <value>as2</value>
                </item>
                <operator name="and" />
                <not>
                    <item>
                        <attribute>DXAGENT_PROTOCOL</attribute>
                        <comparator name="equal" />
                        <value>ftp-comb</value>
                    </item>
                    <operator name="and" />
                    <item>
                        <attribute>DXAGENT_TARGET</attribute>
                        <comparator name="match" />
                        <value>.*\.tmp</value>
                    </item>
                </not>
                <operator name="and" />
                <item>
                    <attribute>DXAGENT_PROTOCOL</attribute>
                    <comparator name="not-equal" />
                    <value>adhoc</value>
                </item>
                <operator name="and" />
                <not>
                    <item>
                        <attribute>DXAGENT_API_CALL</attribute>
                        <comparator name="match"/>
                        <value>ADHOC_PACKAGE_.*</value>
                    </item>
                </not>
            </expression>
        </condition>
        <action Order="yes">
            <inprocess-agent id="1" executeafter="" streamaccess="none" wait="yes" class="com.tumbleweed.st.server.tm.agents.VirtualPathMappingAgent" >
                <params>
                    <param>
                        <param-name>Impersonation</param-name>
                        <param-value>"true"</param-value>
                    </param>
                </params>
            </inprocess-agent>
            <inprocess-agent id="2" executeafter="1" streamaccess="none" class="com.tumbleweed.st.server.tm.agents.CalcAttrsAgent">
                <params>
                    <param>
                        <param-name>Impersonation</param-name>
                        <param-value>"true"</param-value>
                    </param>
                    <param>
                        <param-name>NOASCII</param-name>
                        <param-value>"true"</param-value>
                    </param>
                </params>
            </inprocess-agent>
            <inprocess-agent id="3" executeafter="2" streamaccess="none" class="com.tumbleweed.st.server.tm.agents.NextPrecedence" />
        </action>
</rule>

<rule name="MDNReceipts" type="static" precedence="27">
        <condition>
            <expression>
                <expression>
                    <item>
                        <attribute>EventType</attribute>
                        <comparator name="equal" />
                        <value>Incoming end</value>
                    </item>
                    <operator name="or" />
                    <item>
                        <attribute>EventType</attribute>
                        <comparator name="equal" />
                        <value>Outgoing end</value>
                    </item>
                </expression>
                <operator name="and" />
                <item>
                    <attribute>DXAGENT_CLIENT</attribute>
                    <comparator name="not-equal" />
                    <value>as2</value>
                </item>
                <operator name="and" />
                <not>
                    <item>
                        <attribute>DXAGENT_PROTOCOL</attribute>
                        <comparator name="equal" />
                        <value>ftp-comb</value>
                    </item>
                    <operator name="and" />
                    <item>
                        <attribute>DXAGENT_TARGET</attribute>
                        <comparator name="match" />
                        <value>.*\.tmp</value>
                    </item>
                </not>
                <operator name="and" />
                <item>
                    <attribute>DXAGENT_PROTOCOL</attribute>
                    <comparator name="not-equal" />
                    <value>adhoc</value>
                </item>
                <operator name="and" />
                <not>
                    <item>
                        <attribute>DXAGENT_API_CALL</attribute>
                        <comparator name="match"/>
                        <value>ADHOC_PACKAGE_.*</value>
                    </item>
                </not>
                <operator name="and" />
                <item>
                    <attribute>DXAGENT_FILE_STATUS</attribute>
                    <comparator name="not-equal" />
                    <value>8</value>
                </item>
            </expression>
        </condition>
        <action Order="yes">
            <inprocess-agent id="1" executeafter="" streamaccess="none" class="mdn.MDNAgent">
                <params>
                    <param>
                        <param-name>Impersonation</param-name>
                        <param-value>"true"</param-value>
                    </param>
                    <param>
                        <param-name>SIGNING_ALIAS</param-name>
                        <param-value>mdn</param-value>
                    </param>
                </params>
            </inprocess-agent>
            <inprocess-agent id="2" executeafter="" streamaccess="none" class="com.tumbleweed.st.server.tm.agents.NextPrecedence" />
        </action>
</rule>

</brpackage>

